[
  {
    "schema_version": "1.0.0",
    "report_id": "aerona_2026_04_rollup",
    "report_status": "review",
    "sample_notes": "Representative line only. The full normalized report would contain all 6390 rollup rows and studio allocations.",
    "source": {
      "reporting_party": {
        "source_name": "ADE",
        "canonical_name": "AERONA LLC",
        "canonical_id": null
      },
      "account_holder": "NMG Media LLC",
      "report_type": "royalty_statement",
      "report_family": "aerona_rollup",
      "statement_reference": null,
      "source_files": [
        {
          "file_name": "aecash_item_report.xlsx",
          "sha256": "03727cc30148bf4063f95e7aebdd4559e0d5bf88ce9e08797b999764550afa3a",
          "media_type": "application/vnd.openxmlformats-officedocument.spreadsheetml.sheet",
          "role": "primary",
          "source_locator": "aecash_item_report.csv sheet"
        }
      ]
    },
    "period": {
      "start_date": "2026-04-01",
      "end_date": "2026-04-30",
      "label": "April 2026",
      "statement_date": null,
      "invoice_date": "2026-04-30",
      "due_date": "2026-06-30"
    },
    "currency": "USD",
    "financial_summary": {
      "gross_sales": null,
      "period_royalty_earned": {
        "amount": "81318.52240",
        "currency": "USD"
      },
      "prior_balance": null,
      "collections": null,
      "fees": null,
      "expenses": null,
      "payments": null,
      "reserves": null,
      "adjustments": null,
      "net_payable": {
        "amount": "81318.52240",
        "currency": "USD"
      },
      "components": [
        {
          "type": "ppm",
          "amount": {
            "amount": "9912.879",
            "currency": "USD"
          },
          "source_label": "PPM"
        },
        {
          "type": "rental",
          "amount": {
            "amount": "1164.254",
            "currency": "USD"
          },
          "source_label": "Rental"
        },
        {
          "type": "download",
          "amount": {
            "amount": "19796.320",
            "currency": "USD"
          },
          "source_label": "Download"
        },
        {
          "type": "stream_for_life",
          "amount": {
            "amount": "14595.690",
            "currency": "USD"
          },
          "source_label": "Stream for Life"
        },
        {
          "type": "scenes",
          "amount": {
            "amount": "27533.256",
            "currency": "USD"
          },
          "source_label": "Scenes"
        },
        {
          "type": "unlimited",
          "amount": {
            "amount": "8316.12340",
            "currency": "USD"
          },
          "source_label": "Unlimited"
        }
      ]
    },
    "line_items": [
      {
        "line_id": "aerona_4903414",
        "line_type": "royalty",
        "event_date": null,
        "source_invoice_number": null,
        "studio": {
          "source_name": "5K Porn Movies",
          "canonical_name": null,
          "parent_entity": null,
          "billing_entity": null,
          "lookup_status": "ambiguous"
        },
        "title": {
          "source_title": "Black Creampie Queens",
          "canonical_title": null,
          "source_title_id": "4903414"
        },
        "platform": "ADE",
        "channel": null,
        "territory": null,
        "revenue_type": "mixed_vod",
        "quantity": null,
        "gross_amount": null,
        "share_rate": null,
        "fee_rate": null,
        "fee_amount": null,
        "expense_amount": null,
        "net_amount": {
          "amount": "22.138",
          "currency": "USD"
        },
        "source_location": {
          "file_name": "aecash_item_report.xlsx",
          "sheet_name": "aecash_item_report.csv",
          "page_number": null,
          "row_number": 2,
          "cell_range": "A2:K2",
          "image_name": null
        },
        "raw_fields": {
          "ppm": "0.558",
          "rental": "0.0",
          "download": "6.97",
          "stream_for_life": "2.7",
          "scenes": "11.91",
          "unlimited": "0.0"
        }
      }
    ],
    "allocations": [],
    "accounting_postings": [],
    "validation": {
      "declared_total": {
        "amount": "81318.52240",
        "currency": "USD"
      },
      "computed_total": {
        "amount": "81318.52240",
        "currency": "USD"
      },
      "difference": {
        "amount": "0",
        "currency": "USD"
      },
      "tolerance": {
        "amount": "0.01",
        "currency": "USD"
      },
      "status": "passed",
      "checks": [
        {
          "name": "component_total",
          "status": "passed",
          "message": "All six component totals equal the rollup Total."
        },
        {
          "name": "raw_completeness",
          "status": "warning",
          "message": "Raw platform files omit Unlimited revenue."
        }
      ],
      "issues": [
        "Studio alias for 5K Porn Movies needs approval."
      ],
      "human_review_required": true
    },
    "parser": {
      "parser_family": "xlsx_aerona_rollup",
      "parser_version": "1.0.0",
      "confidence": "0.99",
      "config_version": "1.0.0"
    }
  },
  {
    "schema_version": "1.0.0",
    "report_id": "pulse_nvg_2026_04",
    "report_status": "suppressed",
    "sample_notes": "This example shows why current month sales cannot be used as the posting amount.",
    "source": {
      "reporting_party": {
        "source_name": "Pulse Distribution",
        "canonical_name": "Pulse Distribution",
        "canonical_id": null
      },
      "account_holder": "New Media Group",
      "report_type": "cumulative_royalty_statement",
      "report_family": "pulse_cumulative_balance",
      "statement_reference": null,
      "source_files": [
        {
          "file_name": "NVG Apr2026.xlsx",
          "sha256": "4c9d518533bca8b5458d4709cc87a708c209f488d134fdd398c4053a6e681fdd",
          "media_type": "application/vnd.openxmlformats-officedocument.spreadsheetml.sheet",
          "role": "primary",
          "source_locator": "Summary and supporting history sheets"
        }
      ]
    },
    "period": {
      "start_date": "2026-04-01",
      "end_date": "2026-04-30",
      "label": "Summary report through April 2026",
      "statement_date": null,
      "invoice_date": "2026-04-30",
      "due_date": "2026-06-30"
    },
    "currency": "USD",
    "financial_summary": {
      "gross_sales": {
        "amount": "1900",
        "currency": "USD"
      },
      "period_royalty_earned": null,
      "prior_balance": null,
      "collections": {
        "amount": "257.31",
        "currency": "USD"
      },
      "fees": null,
      "expenses": {
        "amount": "-221602.43",
        "currency": "USD"
      },
      "payments": {
        "amount": "-213174.14",
        "currency": "USD"
      },
      "reserves": null,
      "adjustments": null,
      "net_payable": {
        "amount": "-1305.8785",
        "currency": "USD"
      },
      "components": []
    },
    "line_items": [],
    "allocations": [],
    "accounting_postings": [
      {
        "posting_id": "pulse_nvg_2026_04_hold",
        "posting_type": "hold",
        "customer": "Pulse Distribution",
        "studio": "Net Video Girls",
        "amount": {
          "amount": "-1305.88",
          "currency": "USD"
        },
        "memo": "DVD April 2026",
        "invoice_date": "2026-04-30",
        "due_date": "2026-06-30",
        "vertical": "DVD",
        "invoice_number": null,
        "entered_at": null,
        "exported_at": null,
        "status": "suppressed",
        "suppression_reason": "Negative cumulative balance carried forward.",
        "source_line_ids": []
      }
    ],
    "validation": {
      "declared_total": {
        "amount": "-1305.8785",
        "currency": "USD"
      },
      "computed_total": {
        "amount": "-1305.8785",
        "currency": "USD"
      },
      "difference": {
        "amount": "0",
        "currency": "USD"
      },
      "tolerance": {
        "amount": "0.01",
        "currency": "USD"
      },
      "status": "passed",
      "checks": [
        {
          "name": "posting_policy",
          "status": "passed",
          "message": "Negative balance is preserved and no positive posting is created."
        }
      ],
      "issues": [],
      "human_review_required": false
    },
    "parser": {
      "parser_family": "xlsx_pulse_cumulative_balance",
      "parser_version": "1.0.0",
      "confidence": "0.99",
      "config_version": "1.0.0"
    }
  },
  {
    "schema_version": "1.0.0",
    "report_id": "gamma_licensing_2026_01",
    "report_status": "ready",
    "sample_notes": "The payable is a running balance, while period earned is stored separately.",
    "source": {
      "reporting_party": {
        "source_name": "EENT Inc (EENINC)",
        "canonical_name": "Gamma Broadcast Group Inc. Licensing",
        "canonical_id": null
      },
      "account_holder": "New Media Group",
      "report_type": "running_balance_statement",
      "report_family": "gamma_licensing",
      "statement_reference": "EENT Inc Jan 2026",
      "source_files": [
        {
          "file_name": "EENT Inc (EENINC) Jan 2026 USD 1 861.99.xlsx",
          "sha256": "3c36bbb24d7a4bf15f651078517e1b026ac4c0d78326a3e934a32cfb87a09ce3",
          "media_type": "application/vnd.openxmlformats-officedocument.spreadsheetml.sheet",
          "role": "primary",
          "source_locator": "Monthly Summary, VOD, Linear, and SVOD sheets"
        }
      ]
    },
    "period": {
      "start_date": "2026-01-01",
      "end_date": "2026-01-31",
      "label": "January 2026",
      "statement_date": null,
      "invoice_date": "2026-04-30",
      "due_date": "2026-06-30"
    },
    "currency": "USD",
    "financial_summary": {
      "gross_sales": null,
      "period_royalty_earned": {
        "amount": "1507.082659",